-75.280284,39.871811,Selling my soul to Beyoncé was the best decision I’ve ever made,"Philadelphia, PA","[-75.280284, 39.871811]"
-71.191421,42.227797,I woke up knowing full well that the TL will be 98% about Beyoncé’s performance last night,"Boston, MA","[-71.191421, 42.227797]"
-87.907119,43.081912,"I was completely jealous of everyone who saw Beyoncè last night and then I realized my completely AMAZING,  LOVING,… https://t.co/y62BkDvxAo","Shorewood, WI","[-87.907119, 43.081912]"
-122.035311,37.193164,These Beyoncé at Coachella clips 😍👀,"San Jose, CA","[-122.035311, 37.193164]"
-74.041878,40.570842,Lmfaoo since when you listen to Beyoncé 😭🤦🏾‍♂️ https://t.co/Gh5nn6Gz1k,"Brooklyn, NY","[-74.041878, 40.570842]"
-80.519851,39.719801,Damn Beyonce had to bring back Destinys Child. That’s when you know you washed,"Pennsylvania, USA","[-80.519851, 39.719801]"
-116.2165486,33.653032,"Beyoncé headlining #Coachella  Day 2 + performances by Tyler the Creator, HAIM, Post Malone, Alvvays, MØ, David Byr… https://t.co/BlFtteghUC","Coachella, CA","[-116.2165486, 33.653032]"
-76.7115205,39.197211,Beyoncé just gave HBCUs enough routines to last them until MY daughter attends one in 12 years #Beychella… https://t.co/JghZEJsQ7C,"Baltimore, MD","[-76.7115205, 39.197211]"
-82.905845,39.987076,"My adrenaline was crazy high after #Beychella — couldn’t even go back to sleep at Stupid A.M. 

Meanwhile, Beyoncé… https://t.co/o3delHB6es","Gahanna, OH","[-82.905845, 39.987076]"
-87.579081,41.581483,"The story of how tonight went down before the show...

Beyonce: ""Should I hold back at Coachella?""

Inner Monologue… https://t.co/DvA3wbj747","Calumet City, IL","[-87.579081, 41.581483]"
-97.768683,35.290722,*wakes up. Googles Beyoncé to see what she brought to Coachella* https://t.co/qj6V480Hk9,"Oklahoma City, OK","[-97.768683, 35.290722]"
-75.280284,39.871811,Woke up to Beyonce killing#Beychella,"Philadelphia, PA","[-75.280284, 39.871811]"
-124.482003,32.528832,I saw Beyonce tonight. This picture I took explains how we should all see her. 😍 @ Coachella https://t.co/OMzFFkm7LM,"California, USA","[-124.482003, 32.528832]"
-115.1581427,35.917793,So tired of Beyonce tweets that I have unfollowed people,"Henderson, NV","[-115.1581427, 35.917793]"
-81.18664,34.023702,Bruh just seen @Beyonce dance to Everybody Mad by @otgenasis &amp; I am shook,"Seven Oaks, SC","[-81.18664, 34.023702]"
-87.940033,41.644102,"Itsn6:30 in the morning and Beyoncé’s performance just made a drunk bitch sober as fuck. My eyes have been BLESSED.
Wow. HOUSTON LEGEND.","Chicago, IL","[-87.940033, 41.644102]"
-81.507905,28.3882177,@Beyonce gave us a whole #hbcu experience in one show 😩😩😩  #Beychella,"Orlando, FL","[-81.507905, 28.3882177]"
-74.041878,40.570842,Remember Beyoncé palancing in Trinidad? That was a great moment in history,"Brooklyn, NY","[-74.041878, 40.570842]"
-94.043628,28.855128,Beyoncè really got 3 hashtags trending rn... 💯,"Louisiana, USA","[-94.043628, 28.855128]"
-74.041878,40.570842,Beyoncé is just flat-out stunning. #Coachella https://t.co/lRLLZbuDmE,"Brooklyn, NY","[-74.041878, 40.570842]"
-109.060257,36.992427,Holy shit. I just watched @Beyoncé’s @Coachella set and it’s probably the best performance I’ve ever seen. Not gonn… https://t.co/bU2JGKVZqD,"Colorado, USA","[-109.060257, 36.992427]"
-77.119401,38.801826,beyonce bout thick as a mf,"Washington, DC","[-77.119401, 38.801826]"
-122.067214,37.827626,BEYONCÉ DID SOOO FUCKING AMAZING OMFG,"Alamo, CA","[-122.067214, 37.827626]"
-74.026675,40.683935,Where can I watch Beyonce’s performance pls?,"Manhattan, NY","[-74.026675, 40.683935]"
-73.933612,40.785365,It's crazy female rappers will fight to call themselves the queen..meanwhile beyonce will always remain unchallenge… https://t.co/d1lCGd1xDW,"Bronx, NY","[-73.933612, 40.785365]"
-97.768683,35.290722,Beyoncé on the right https://t.co/NTw4JOFWTM,"Oklahoma City, OK","[-97.768683, 35.290722]"
-116.5677878,33.7794258,Not to be dramatic but Beyoncè really did cure my depression wow,"Palm Springs, CA","[-116.5677878, 33.7794258]"
-73.637602,40.58311,"Youngster: Did you watch #beychella last night???
Me: I’m too old to stay up that late! 
Them: I think you and Beyo… https://t.co/MVvx2IoT1j","Lido Beach, NY","[-73.637602, 40.58311]"
-80.386249,25.761172,Beyoncé killed the Coachella festival 🙌🏻,"Fountainebleau, FL","[-80.386249, 25.761172]"
-75.5093951,40.612311,"Slept for 3 hours now, I’m up and ready and still thinking to myself on how the world doesn’t deserve Beyoncé #Beychella","Fullerton, PA","[-75.5093951, 40.612311]"
-84.576827,33.6475029,Beyonce said school spirit mother fuckasssss,"Atlanta, GA","[-84.576827, 33.6475029]"
-80.995487,34.051162,Beyoncé &amp; Solange dancing reminds me of my big sister &amp; I... I’m so ready for May,"Dentsville, SC","[-80.995487, 34.051162]"
-87.940033,41.644102,I woke myself up out my sleep to be able to see Beyoncé and it was the best decision I’ve ever made in my life. I c… https://t.co/YR98GnGzcM,"Chicago, IL","[-87.940033, 41.644102]"
-124.482003,32.528832,Freedom #beychella #coachella #beyoncé #bestnightever @ Coachella 2018 https://t.co/l2YPOLHK3q,"California, USA","[-124.482003, 32.528832]"
-82.758209,27.694323,For everyone who didn’t get to watch #BEYCHELLA or want to relive its glory : https://t.co/ucGuRdNAtm,"St Petersburg, FL","[-82.758209, 27.694323]"
-73.508143,41.187054,My daughter when she finds out a marching band played with Beyonce https://t.co/KpNVvg3j93,"Massachusetts, USA","[-73.508143, 41.187054]"
-85.605166,30.355644,I wish I had someone to love me like y'all love beyonce.,"Georgia, USA","[-85.605166, 30.355644]"
-92.6515126,34.53414,"Beyonce shows be amazing bro, I can’t even front.","Benton, AR","[-92.6515126, 34.53414]"
-86.6703927,33.324665,@theyoncehub @AMoravcov Beyoncé did not come to play https://t.co/HzUrux0o5K,"Chelsea, AL","[-86.6703927, 33.324665]"
-83.786106,32.7528097,I just cried watching Beyoncé’s performance,"Macon, GA","[-83.786106, 32.7528097]"
-80.0295184,35.962623,"Woke up and all I see is Beyonce on my TL, y’all really worship that woman 😂","Greensboro, NC","[-80.0295184, 35.962623]"
-80.20811,26.080935,Beyoncé is so Black 🐝🐝🐝,"Fort Lauderdale, FL","[-80.20811, 26.080935]"
-118.668404,33.704538,Don’t worry. I’m going to post one more  set.  beyonce killed coachella | #beyonce #coachella @… https://t.co/TQdmWMGmpl,"Los Angeles, CA","[-118.668404, 33.704538]"
-75.280284,39.871811,I fell asleep and missed Beyoncé 😩,"Philadelphia, PA","[-75.280284, 39.871811]"
-116.4932477,33.759319,This was literally so fucking cool! Tooooo much!! #Coachella2018 #Beyonce https://t.co/lYJjdHIInD,"Cathedral City, CA","[-116.4932477, 33.759319]"
-73.933612,40.785365,Why can’t I find a video of Beyoncé’s performance and not people review Ming it? I need help,"Bronx, NY","[-73.933612, 40.785365]"
-77.119401,38.801826,Wait...did beyonce have set on stage last night @LilianeBedford!?!? 👀,"Washington, DC","[-77.119401, 38.801826]"
-78.864178,42.767924,@Beyonce made me a proud @JacksonStateU alum all over again. #Coachella18 #Beychella hbcu,"Blasdell, NY","[-78.864178, 42.767924]"
-77.601044,37.447046,For everybody that needs to see Beyoncé’s full performance https://t.co/ScT9ruk6Br,"Richmond, VA","[-77.601044, 37.447046]"
-83.155993,42.467529,Wow the Coachella crowd looks so peaceful after Beyonce’s set last night. https://t.co/hL0FNX9WlT,"Pleasant Ridge, MI","[-83.155993, 42.467529]"
-85.86503,33.615344,#beychella #everybodymad #sheslayed @Beyonce Love you!!!! 👸🏾 👸🏾 🐝🐝🐝🐝🐝🐝🐝🐝🐝🐝 https://t.co/3bLEMoEiUV,"Anniston, AL","[-85.86503, 33.615344]"
-74.026675,40.683935,Watching clips from #beychella last night... truly @Beyonce is undisputed the best live performance since MJ...… https://t.co/oK5WVVeImV,"Manhattan, NY","[-74.026675, 40.683935]"
-73.933612,40.785365,Beyonces chains are made with vibranium...y'all can't tell me no different @Beyonce #beyonce #BeyHive #Beycheclla https://t.co/t8n906oqbu,"Bronx, NY","[-73.933612, 40.785365]"
-84.576827,33.6475029,"Men, listen to me. All that matters to your woman today is #Beychella. Don’t mention #NBAPlayoffs; nobody cares. Sp… https://t.co/5efc5Gd29Z","Atlanta, GA","[-84.576827, 33.6475029]"
-77.037081,38.688359,"I adnire Jay Z cuz he the only person that can tell Beyonce ""No"" lol gaaaahhhhhhh https://t.co/Yj5IoPhCoH","Fort Washington, MD","[-77.037081, 38.688359]"
-85.605166,30.355644,That boy scooter a drummer for Beyoncé? #Talented #CountMusic https://t.co/3QvBZqtC0p,"Georgia, USA","[-85.605166, 30.355644]"
-93.128629,31.718432,When your friend screen recorded the whole 2 hour Beyoncè performance while you slept peacefully. Thanks @prettiboi_est92 💃🏾,"Natchitoches, LA","[-93.128629, 31.718432]"
-83.288056,42.255085,Yup. Muting Beyonce for the day.,"Detroit, MI","[-83.288056, 42.255085]"
-118.668404,33.704538,Beyonce and Destinys Child did that. That was great. 💥🔥🌟✨#COACHELLA,"Los Angeles, CA","[-118.668404, 33.704538]"
-75.369851,40.426894,I fell asleep right before Beyonce  came out 😂,"Quakertown, PA","[-75.369851, 40.426894]"
-74.256053,40.708063,Woke my girl up at 1:55 am to watch Beyoncè but she ain’t wake up now she’s mad she missed her 😂😂,"Irvington, NJ","[-74.256053, 40.708063]"
-81.396939,28.48211,"As much as I still don’t like Coachella, I would be pooping my pants if I saw that performance of the Destiny’s Chi… https://t.co/RjRU6AJWfw","Holden Heights, FL","[-81.396939, 28.48211]"
-124.482003,32.528832,Beyoncé THANK YOU! 🙏🏾,"California, USA","[-124.482003, 32.528832]"
-81.711158,39.271285,Beyoncé is the love of my life😍🤤,"Redbush, OH","[-81.711158, 39.271285]"
-80.0295184,35.962623,still waiting for the day I see Beyonce in some pants,"Greensboro, NC","[-80.0295184, 35.962623]"
-87.634643,24.396308,"Me: I had the best day ever yesterday and nobody could ever top this 

Beyoncé: https://t.co/7jpDmxYFB1","Florida, USA","[-87.634643, 24.396308]"
-73.962582,40.541722,How we’re heading to brunch today with the girls after watching #Beychella 👯‍♀️ | #coachella #beyonce https://t.co/42ge7IAsSv,"Queens, NY","[-73.962582, 40.541722]"
-75.280284,39.871811,Beyoncé’s Coachella performance&gt;&gt;&gt;&gt;&gt;&gt;&gt;&gt;&gt;&gt;,"Philadelphia, PA","[-75.280284, 39.871811]"
-80.4081604,25.956799,"No disrespect to Shawn Carter, but Beyonce got a lil 🍑🎂🍑🎂 https://t.co/fkY55AoLSm","Miramar, FL","[-80.4081604, 25.956799]"
-88.544163,44.192468,"I’ve always wanted to go to #Coachella but I know myself enough to know that a) I don’t like huge crowds, b) I hate… https://t.co/zOYJX8MUYe","Menasha, WI","[-88.544163, 44.192468]"
-81.396939,28.48211,Literally waiting for this weeks episode of #nytstillprocessing podcast to hear @jennydeluxe and Wesley talk about… https://t.co/5HQ3iXbVQf,"Holden Heights, FL","[-81.396939, 28.48211]"
-75.280284,39.871811,I need Beyoncé’s publicists https://t.co/7eOPY4yTaE,"Philadelphia, PA","[-75.280284, 39.871811]"
-74.041878,40.570842,Beyonce was the reason I almost went into labor  four years ago. VMAS performance put me the fuckout . Couldnt chan… https://t.co/GH4UO0MpJn,"Brooklyn, NY","[-74.041878, 40.570842]"
-77.119401,38.801826,Lo que ha cambiado Beyonce en una sola noche. Impresionante,"Washington, DC","[-77.119401, 38.801826]"
-94.043628,28.855128,The audience is dead af. Beyoncé has 1 album left in her. #Beycheclla 🍍 https://t.co/DgptQ7uKid,"Louisiana, USA","[-94.043628, 28.855128]"
-73.946553,41.168161,Let me tell you how Marni and Olivier spun gold for Beyonce!,"Croton-on-Hudson, NY","[-73.946553, 41.168161]"
-96.977527,32.620678,Beyoncé makes history with Coachella performance https://t.co/spBIQCotja,"Dallas, TX","[-96.977527, 32.620678]"
-87.940033,41.644102,"Beyoncé is our generations greatest artiste. Yes both male and female. You don’t agree, kill yourself. https://t.co/HupL9pVms0","Chicago, IL","[-87.940033, 41.644102]"
-74.041878,40.570842,I didn’t stay awake to watch Beyoncé 😢 where is the link,"Brooklyn, NY","[-74.041878, 40.570842]"
-87.634643,24.396308,I don’t like Beyoncé’s music as a solo artist but I can recognize her achievements. That being said....SHE BROUGHT… https://t.co/Vn1LrLCIgX,"Florida, USA","[-87.634643, 24.396308]"
-84.576827,33.6475029,yo beyonce been doing the lamest dance moves since like 2004 how are y’all still impressed,"Atlanta, GA","[-84.576827, 33.6475029]"
-74.041878,40.570842,At first I was sad about missing Beyoncé and #BEYCHELLA but this changed the course of my day. I’m no longer the ki… https://t.co/d6bwrtaDW7,"Brooklyn, NY","[-74.041878, 40.570842]"
-84.710722,39.052962,Beyonce sang the black national anthem at Coachella.,"Cincinnati, OH","[-84.710722, 39.052962]"
-91.218994,30.354161,Beyoncè showing u why we a legend #Coachella2018,"Baton Rouge, LA","[-91.218994, 30.354161]"
-116.374494,43.510172,@tanner_c95 GIVE @Beyonce HER GRAMMY!!! https://t.co/5lXph6JW9g,"Boise, ID","[-116.374494, 43.510172]"
-82.0691698,41.346019,"@PageSix Here’s where you’re wrong, and you should know this Page Six, they’re not “her Coachella pics”. Those phot… https://t.co/Fw2Yv4afbt","North Ridgeville, OH","[-82.0691698, 41.346019]"
-74.026675,40.683935,This is what happens when ya mentor is BEYONCÉ 😍🙌🏾 https://t.co/13eHJViIiw,"Manhattan, NY","[-74.026675, 40.683935]"
-84.515906,42.704505,god why isn’t Beyoncé president yet,"East Lansing, MI","[-84.515906, 42.704505]"
-76.448383,36.66,"Heard Beyoncé killed Coachella lastnight, gotta watch","Chesapeake, VA","[-76.448383, 36.66]"
-76.974612,38.942717,"If you ever wondered what HBCU culture is, Beyoncé’s performance was it!!!!","Hyattsville, MD","[-76.974612, 38.942717]"
-96.977527,32.620678,Piers Morgan sitting at rest home’s business center plottin’ up reasons to come for Beyoncé’s greatness. #Beychella https://t.co/DDmHACUYmG,"Dallas, TX","[-96.977527, 32.620678]"
-73.962582,40.541722,"Beyoncé gave us one of the best performances in history. 

I’m just hoping I don’t see a bunch of white folks runni… https://t.co/2RZRqRTnCY","Queens, NY","[-73.962582, 40.541722]"
-74.211939,41.147774,"Before I even got out of bed this morning I spent an hour watching Beyoncé at Coachella clips, so I basically feel… https://t.co/KtZfcSd3AM","Sloatsburg, NY","[-74.211939, 41.147774]"
-87.940033,41.644102,Beyoncé is the greatest living entertainer on the planet. https://t.co/6LzNpgr3FL,"Chicago, IL","[-87.940033, 41.644102]"
-74.026675,40.683935,"Wakes up, checks twitter, sees a tweet, ""BEYONCÉ JUST PUT ON THE GREATEST PERFORMANCE OF ALL TIME #BeyChellla"" ...… https://t.co/5UNBYTrrnJ","Manhattan, NY","[-74.026675, 40.683935]"
-87.486546,36.4602,I’m i the only who gives no fcks bout Beyoncé ? 🤨 she’s so overrated.,"Clarksville, TN","[-87.486546, 36.4602]"
-85.461887,40.121825,Whattt. Like you're literally Beyoncé.. https://t.co/MbgH1WV4PW,"Muncie, IN","[-85.461887, 40.121825]"
-102.051769,36.9931101,Me laying in my bed watching all the @Beyonce videos on social media the morning after ‘cuz my ahh was sleep....😂😂… https://t.co/4rNj2vcw7f,"Kansas, USA","[-102.051769, 36.9931101]"
-75.280284,39.871811,"The weather sucks, but God is good, The sixers are balling in the playoffs &amp; Beyoncé Reunites with Destiny's Child.… https://t.co/qblgLUs61N","Philadelphia, PA","[-75.280284, 39.871811]"
-85.605166,30.355644,Woke up to WW3 and Beyoncé,"Georgia, USA","[-85.605166, 30.355644]"
-80.229746,25.8922648,Beyoncé killed Coachella ❤️❤️😍.,"Golden Glades, FL","[-80.229746, 25.8922648]"
-85.847503,38.108678,@nikkiLynette @jeffm8_bs @KarenEvansJack @ThePerezHilton @Beyonce How is that even a question? Why wouldn't the med… https://t.co/U2lSHv9UOp,"Louisville, KY","[-85.847503, 38.108678]"
-97.340667,32.988286,Watching Beyoncé ‘s performance at Coachella just gave me the motivation I need for the rest of the year,"Roanoke, TX","[-97.340667, 32.988286]"
-76.448383,36.66,How could you not love @Beyonce !!! Omfg she killed #BEYCHELLA 😭😩.,"Chesapeake, VA","[-76.448383, 36.66]"
-76.7115205,39.197211,Beyonce is the best of her generation but we will not disrespect Icons that came before her..they are in their own lane,"Baltimore, MD","[-76.7115205, 39.197211]"
-84.449769,39.254798,I still can’t believe Emiliano was born the same day as @Beyonce  😭❤️,"Sharonville, OH","[-84.449769, 39.254798]"
-77.107345,35.832515,"I’m proud to say that Beyoncé is my favorite artists . She’s creative, make great music, she can dance and sing liv… https://t.co/IpVrj6l3Z1","Williamston, NC","[-77.107345, 35.832515]"
-84.576827,33.6475029,Mutes Beyoncé...,"Atlanta, GA","[-84.576827, 33.6475029]"
-118.931619,34.227495,Beyoncé isn’t all that. St. Vincent owned Coachella and is way hotter.,"Santa Rosa Valley, CA","[-118.931619, 34.227495]"
-77.119401,38.801826,That was one of my top @Beyonce performances ever 🐝 #beychella it will never be another her https://t.co/PLTb77NE1T,"Washington, DC","[-77.119401, 38.801826]"
-124.482003,32.528832,"beyonce performing that #Flawless prod by. @reyreel 

Wish I could have caught this live and in… https://t.co/BPJsCRZYaK","California, USA","[-124.482003, 32.528832]"
-95.2875574,29.953846,I think I’m psychic....I literally just told someone the other day I wish Beyonce would open an HBCU then sis performed as an HBCU!!!!😳😳😳😳,"Humble, TX","[-95.2875574, 29.953846]"
-83.67529,36.540739,Last point about this #FalseIdol @Beyonce her and her husband are the people that if #America went #Socialist they’… https://t.co/0ROWLtG6f1,"Virginia, USA","[-83.67529, 36.540739]"
-85.605166,30.355644,@rhondasaddress Sick bitch you sold your soul @Beyoncé,"Georgia, USA","[-85.605166, 30.355644]"
-87.674421,41.4814262,Whomever that white girl was that called beyonce overrated mentions is looking ‘09 twitter right now  😭😭😭😭😭😭,"Chicago Heights, IL","[-87.674421, 41.4814262]"
-88.792846,41.883102,"Beyonce throwing stands, destiny child reunion, marching band at her concert 😍😍 I can't wait to see her in August","DeKalb, IL","[-88.792846, 41.883102]"
-90.051852,38.643745,Beyoncé was killin’ it last night #Beychella https://t.co/SfU8ro80HF,"Collinsville, IL","[-90.051852, 38.643745]"
-81.046876,35.001706,what a hater you just be if you don’t like Beyoncé. 🤷🏽‍♀️,"Charlotte, NC","[-81.046876, 35.001706]"
-85.605166,30.355644,Beyoncé thicco https://t.co/Ykn0DILFDj,"Georgia, USA","[-85.605166, 30.355644]"
-111.960775,33.4358637,I’ve never seen Beyoncé not kill it in my life 😮,"Scottsdale, AZ","[-111.960775, 33.4358637]"
-80.220059,26.1505822,King Beyonce. President Beyonce.,"Lauderdale Lakes, FL","[-80.220059, 26.1505822]"
-79.487651,37.886607,muting beyoncé,"Maryland, USA","[-79.487651, 37.886607]"
-77.001308,38.760754,I was to tired to stay up last nigt to see beyonce wtf.,"Oxon Hill, MD","[-77.001308, 38.760754]"
-122.2687696,47.475396,"Just read a s-ton of tweets from the same girl, losing it over #Beychella and literally thanking life for living wh… https://t.co/W65MXBbrcE","Bryn Mawr, WA","[-122.2687696, 47.475396]"
-93.329515,44.889964,Everything Beyoncé gives us is a gift. We do not deserve Beyoncé. https://t.co/ZkHJGThePa,"Minneapolis, MN","[-93.329515, 44.889964]"
-74.026675,40.683935,Watching Coachella Live is so meh after seeing Beyoncé with Destiny's Child—Amazing!! https://t.co/OL6l6z3fZG via @pagesix,"Manhattan, NY","[-74.026675, 40.683935]"
-73.962582,40.541722,"Also, Beyoncé’s org is filled with Greeks.

#Beychella #coachella2018 https://t.co/ycWF3YifJS","Queens, NY","[-73.962582, 40.541722]"
-86.418059,32.2845933,"Wow, I missed Beyoncé’s performance 💀","Montgomery, AL","[-86.418059, 32.2845933]"
-81.877771,41.392684,Beyoncé just so raw man. My favorite artist!!!!!,"Cleveland, OH","[-81.877771, 41.392684]"
-114.818269,31.3322463,beyoncé,"Arizona, USA","[-114.818269, 31.3322463]"
-75.280284,39.871811,The #beychella moments will get you right out of Bed and get Busy!!! 🙌🏾🙌🏾 #beyonce #coachella… https://t.co/JRVrpPJyDE,"Philadelphia, PA","[-75.280284, 39.871811]"
-74.041878,40.570842,@RBraceySherman @Beyonce Also... Imma need folks to stop telling people of color to shut up and ________ (fill in t… https://t.co/QhdoAQ2SYz,"Brooklyn, NY","[-74.041878, 40.570842]"
-86.348441,39.631677,"Deadass, stayed about a block away from here when I was in NOLA in ‘16 for Beyoncé. Food is 🔥🔥🔥🔥. This is where the… https://t.co/rA0hTVOniI","Indianapolis, IN","[-86.348441, 39.631677]"
-90.137908,29.889574,I’m definitely convinced after that Coachella performance that if Beyoncé would have went to college she be at Sout… https://t.co/4h8PwurjBb,"New Orleans, LA","[-90.137908, 29.889574]"
-85.52501,43.605695,Beyoncè really brought out Destiny's Child at Beychella and I'm not okay with not being there,"Big Rapids, MI","[-85.52501, 43.605695]"
-85.605166,30.355644,@BritniDWrites @Beyonce White people will literally physically fight over sports. If they were the ones who had to… https://t.co/mkpvrYNnln,"Georgia, USA","[-85.605166, 30.355644]"
-84.8203089,38.403186,So I'm just gonna assume Beyonce just brought Pac out of the grave and reanimated the corpse of elvis because no one will stfu about her.,"Ohio, USA","[-84.8203089, 38.403186]"
-83.288056,42.255085,I forgot to set my alarm and missed Beyonce at Coachella!!! https://t.co/jFstiW18nw,"Detroit, MI","[-83.288056, 42.255085]"
-98.778559,29.141956,But DID YALL SEE BEYONCÉ FUCKING IT UPPPPP LAST NIGHT 🐝,"San Antonio, TX","[-98.778559, 29.141956]"
-73.962582,40.541722,That Beyoncé performance showed me that people will really hate anything.,"Queens, NY","[-73.962582, 40.541722]"
-76.7115205,39.197211,Nobody fuckin with Beyoncé on NO LEVEL none of your faves will NEVER.,"Baltimore, MD","[-76.7115205, 39.197211]"
-98.778559,29.141956,I’m sad I didn’t stay up to see Beyoncé’s performance and I’m even sadder I didn’t buy tickets to her concert,"San Antonio, TX","[-98.778559, 29.141956]"
-71.31931,41.518209,me waking up realizing i slept through beyoncé’s live stream https://t.co/EFSPQlVNCr,"Melville, RI","[-71.31931, 41.518209]"
-116.2165486,33.653032,"beyonce 🔥 Production crazy!! #queenb 🐝 #coachella #formation @ Coachella, California https://t.co/i3oSC3aLn5","Coachella, CA","[-116.2165486, 33.653032]"
-71.191421,42.227797,Kelly Rowland&gt;Beyonce,"Boston, MA","[-71.191421, 42.227797]"
-87.940033,41.644102,I can't even be mad at Beyonce being the greatest live performer of our generation. Aligning her career-arch to LeB… https://t.co/Y61a02N3za,"Chicago, IL","[-87.940033, 41.644102]"
-117.282538,32.53962,"@addatude_ Would literally walk into a volcano to see @Beyonce so, y’know, live a little ;).","San Diego, CA","[-117.282538, 32.53962]"
-82.45491,28.054805,"i need to text isaiah to see if he’s srill alive, Beyonce his mom","University, FL","[-82.45491, 28.054805]"
-84.710722,39.052962,can we get a blackchella bc them white people did not know how to act when Beyonce started swag surfin’ 😂😂😂😂😭 #Coachella2018 #BeyChella,"Cincinnati, OH","[-84.710722, 39.052962]"
-73.585294,42.585224,Beyonce might have become President last night,"Averill Park, NY","[-73.585294, 42.585224]"
-77.524353,37.5961839,I hope they put Beyoncé’s performance on tidal.,"Dumbarton, VA","[-77.524353, 37.5961839]"
-85.847503,38.108678,@iaintsavinem @kaydennis_ MJ is. But Beyoncé is the best of our generation. If CB has the vocals to go along w his… https://t.co/e5VO1rMqMj,"Louisville, KY","[-85.847503, 38.108678]"
-80.2006,26.644671,There is no way I'm missing Beyonce's upcoming concert. If I gotta touch my savings then SO B. IT.,"West Palm Beach, FL","[-80.2006, 26.644671]"
-74.5793058,40.2397437,Beyonce performs at coachella and random verified twitters still find a way to drag taylor swift for something.....… https://t.co/uUw0Qg13Z2,"Hightstown, NJ","[-74.5793058, 40.2397437]"
-75.280284,39.871811,"Beyoncé's performance last night looked incredible! Like literally, how did she do that? 
https://t.co/ljz7le0Hk8","Philadelphia, PA","[-75.280284, 39.871811]"
-80.2006,26.644671,Beyonce literally makes herself big because she knows how to put on a show &amp; entertain! This lady is a goddess wow,"West Palm Beach, FL","[-80.2006, 26.644671]"
-95.823268,29.522325,THE AMOUNT OF INFO YALL KNOW ABOUT BEYONCE IS INCREDIBLY WEIRD.,"Houston, TX","[-95.823268, 29.522325]"
-87.940033,41.644102,Bitchhhhh these video clips of @Beyonce #Coachella18 last night got my spirit shook... DAMN...this heifer put on a… https://t.co/SzOuJTomXz,"Chicago, IL","[-87.940033, 41.644102]"
-77.119401,38.801826,"hi lathies &amp; gentlemen, here’s the link to Beyoncé’s Coachella performance https://t.co/9ohLh09jhQ","Washington, DC","[-77.119401, 38.801826]"
-82.069567,26.531814,Beyoncé’s tribe is solid. Without them there would be no Bey. https://t.co/aWagdVmMxb,"Cape Coral, FL","[-82.069567, 26.531814]"
-84.576827,33.6475029,Anybody else can’t sleep? Fucking Beyoncé........ https://t.co/SD9zWL2Ubw,"Atlanta, GA","[-84.576827, 33.6475029]"
-75.280284,39.871811,@SiMonaLisaaa @xsamiiiix @Beyonce @KELLYROWLAND I fell asleep before I could see this part but I know it’ll probably be on tidal. 🤗,"Philadelphia, PA","[-75.280284, 39.871811]"
