-87.940033,41.644102,I’m just going to watch the @Beyonce #BeyChellla replay for the rest of my life.,"Chicago, IL","[-87.940033, 41.644102]"
-98.778559,29.141956,Beyonce’s Coachella set literally changed the course of nature and life as we know it. #beychella2018,"San Antonio, TX","[-98.778559, 29.141956]"
-79.195342,34.936245,this is exactly why I love beyoncé so much #countingdownthedays! I’m so ready to see her on tour! 3 months!!,"Fayetteville, NC","[-79.195342, 34.936245]"
-95.823268,29.522325,Yo beyonce knew she was gonna kill this shit #Beychella,"Houston, TX","[-95.823268, 29.522325]"
-75.280284,39.871811,@EARTHandPEACE @StormInferno You are so right re:the differences with the sound crew! I still loved it next week wi… https://t.co/iMCd8ZnjfX,"Philadelphia, PA","[-75.280284, 39.871811]"
-116.303933,33.72916,Can we take time to congratulate THE REAL QUEEN @Beyonce for making Coachella history... Beychella it is. https://t.co/vkxjFAC3mt,"Bermuda Dunes, CA","[-116.303933, 33.72916]"
-76.796517,39.283539,Beyoncé has made me even prouder i attended an #HBCUpride,"Woodlawn, MD","[-76.796517, 39.283539]"
-84.576827,33.6475029,Which sororities bout to offer @Beyonce an honorary membership? #Coachella18,"Atlanta, GA","[-84.576827, 33.6475029]"
-79.487651,37.886607,"@LookAtDustin Every time Beyoncé milly rocks, a well behaved child is born 😍🙌🏾","Maryland, USA","[-79.487651, 37.886607]"
-116.323001,33.599493,i was 6 feet away from beyoncé...i can die happy now,"La Quinta, CA","[-116.323001, 33.599493]"
-73.933612,40.785365,RelationshipGoals: Jay-Z &amp; Beyoncé When They Were oN The Rise..,"Bronx, NY","[-73.933612, 40.785365]"
-76.9482469,34.85557,damn if i knew I could go viral for screen recording beyonce last night I would’ve 😂,"Havelock, NC","[-76.9482469, 34.85557]"
-124.482003,32.528832,#coachella #beyonce @ Coachella https://t.co/QnYAzNqcDI,"California, USA","[-124.482003, 32.528832]"
-124.482003,32.528832,Les Twins at Coachella 2018 performing with beyonce 💙 #lestwins #lestwinsfam #loveslestwins… https://t.co/ZfG1ljni36,"California, USA","[-124.482003, 32.528832]"
-80.0295184,35.962623,Beyoncé is really like....Beyoncé. Wow a legend before our eyes I can’t wait to tell me kids about her,"Greensboro, NC","[-80.0295184, 35.962623]"
-116.374119,33.6718148,Imagine being the act to follow @Beyonce at #Beychella #Coachella https://t.co/Q2dn7LmOvU,"Indian Wells, CA","[-116.374119, 33.6718148]"
-87.634643,24.396308,People really don’t like Beyoncé because of the way other people love her... and that’s just a life I wouldn’t wanna live...,"Florida, USA","[-87.634643, 24.396308]"
-92.158649,30.115967,Wtf is going on with Beyonce? Why everybody talking about her? Someone help,"Lafayette, LA","[-92.158649, 30.115967]"
-96.015096,30.061706,"My boyfriend was trying to wake me up to watch Beyoncé, y’all know what I said. 🙃

 I told this man I’m going to Be… https://t.co/gZjeCNFA3L","Prairie View, TX","[-96.015096, 30.061706]"
-84.576827,33.6475029,@HilliardRJones @Beyonce It’s all good. I’m there in July!!!,"Atlanta, GA","[-84.576827, 33.6475029]"
-90.137908,29.889574,@suggajay Beyoncé got the girls upset,"New Orleans, LA","[-90.137908, 29.889574]"
-84.5968051,33.895088,Beyonce sure does know how to entertain.,"Marietta, GA","[-84.5968051, 33.895088]"
-80.0295184,35.962623,The same thing happens to Beyoncé. She stands there not movin a muscle &amp; the crowd goes wild... https://t.co/8GVqDRHzBK,"Greensboro, NC","[-80.0295184, 35.962623]"
-92.57133,31.22783,why are people on my tl comparing michael jackson and beyonce? y’all really weird asf,"Alexandria, LA","[-92.57133, 31.22783]"
-74.026675,40.683935,how many pictures of Beyoncé can the internet hold? And how many have I liked today?,"Manhattan, NY","[-74.026675, 40.683935]"
-97.538285,32.569477,"Beyoncé is, cut and dry, the greatest entertainer of our generation. Others simply CANNOT COMPETE! https://t.co/VEDd2M14lZ","Fort Worth, TX","[-97.538285, 32.569477]"
-90.139368,32.318044,I need Beyoncé’s Louboutin holographic fringe boots... I mean I don’t leave my house but I still need them,"Flowood, MS","[-90.139368, 32.318044]"
-118.668404,33.704538,"As the Ambassador for Rhythm Nation, Wakanda Division

We the people of J-tribe would like to extent a congratulati… https://t.co/KubMtVNC8U","Los Angeles, CA","[-118.668404, 33.704538]"
-81.133668,29.127565,Beyoncé said I’m taking y’all to class foreal,"Daytona Beach, FL","[-81.133668, 29.127565]"
-115.1581427,35.917793,"I’m not a Beyoncé apologist, but when I have let other people choose my pics for media use they always choose the l… https://t.co/a7nIxbSVuY","Henderson, NV","[-115.1581427, 35.917793]"
-95.823268,29.522325,I’m just looking back on Beyoncé’s performance. Damn did she really have to kill it like that 😩🔥🔥🔥🔥🔥,"Houston, TX","[-95.823268, 29.522325]"
-72.6467187,41.561522,"#BeyChella got me hype for this summer, I can’t wait to see you in Boston 😭🤩😭🤩😭🤩😭 @Beyonce","Portland, CT","[-72.6467187, 41.561522]"
-80.067777,40.551872,Y’all Greek people gotta chill. It’s not that deep that Beyoncè impersonated Greek life. She is an entertainer 🤦🏽‍♂️,"McCandless, PA","[-80.067777, 40.551872]"
-118.668404,33.704538,Why do people keep comparing Beyonce to Michael Jordan?,"Los Angeles, CA","[-118.668404, 33.704538]"
-118.668404,33.704538,@Beyonce u are a true queeen 👑🐝🐝🐝🐝🐝,"Los Angeles, CA","[-118.668404, 33.704538]"
-90.3205158,38.5331934,Good afternoon #blackwomen #wonderwoman #beyoncé This is how I see you all feeling this day after last nights perfo… https://t.co/ZRrastxypx,"St Louis, MO","[-90.3205158, 38.5331934]"
-74.041878,40.570842,"I’m hoping a behind-the-scenes vid comes out of Beyoncé prepping for #Beychella. Throwback to her focus, vision, &amp;… https://t.co/l912a8YppX","Brooklyn, NY","[-74.041878, 40.570842]"
-81.046876,35.001706,The homie Jasmine really be out there killin shit with Beyonce haha that’s wassup man,"Charlotte, NC","[-81.046876, 35.001706]"
-74.026675,40.683935,I haven’t been to the African American museum in DC yet but is there a Beyonce section? It definitely needs a Beyonce section.,"Manhattan, NY","[-74.026675, 40.683935]"
-115.2092535,35.984784,"@astuhrid @Beyonce Happy Belated Birthday!! So dope you got to see them all on your bday, very jealous! Hope the re… https://t.co/idUS4hjG0e","Paradise, NV","[-115.2092535, 35.984784]"
-117.296536,33.858759,Beyonce is overrated as fuck,"Moreno Valley, CA","[-117.296536, 33.858759]"
-85.605166,30.355644,Beyoncè is the best female performer of all time and Michael Jackson is the best male performer of all time they are 2 Goats,"Georgia, USA","[-85.605166, 30.355644]"
-87.022482,35.9945681,I need a friend that really wants to go see Beyoncé w. Me cause none of mine thinks it’s worth it 😭,"Nashville, TN","[-87.022482, 35.9945681]"
-80.519851,39.719801,@Siddeeq_ Gathering my money and letter of recommendation now. Pulling up all receipts of time I’ve spent streaming… https://t.co/Oa0HHl1ATK,"Pennsylvania, USA","[-80.519851, 39.719801]"
-89.57151,36.497129,Stfu about Beyoncé y’all been annoying for the past few years,"Kentucky, USA","[-89.57151, 36.497129]"
-87.940033,41.644102,How did Beyonce have a better collegiate experience than I did and she didn’t even go to college? #Beyonce #beychella #istillgotstudentloans,"Chicago, IL","[-87.940033, 41.644102]"
-118.256783,33.943092,Beyoncè thighs man mine better look like that,"Florence-Graham, CA","[-118.256783, 33.943092]"
-90.135782,34.994192,BEYONCÈ IS GONNA BE IN NASHVILLE AUGUST 23rd!! A DAY BEFORE MY FUCKING BIRTHDAY!! MY VIRGO QUEEN DID THIS FOR ME. https://t.co/rHZKTCK50w,"Memphis, TN","[-90.135782, 34.994192]"
-89.173876,42.171924,Beyoncé &amp; Solange did that!!,"Rockford, IL","[-89.173876, 42.171924]"
-71.191421,42.227797,Beyoncé all over my TL but nbs she killed it,"Boston, MA","[-71.191421, 42.227797]"
-96.015096,30.061706,Beyoncé &gt;&gt;&gt;&gt; just amazing,"Prairie View, TX","[-96.015096, 30.061706]"
-80.457446,27.20569,I mad I wasn’t in Cali for Coachella this weekend especially after watching Beyoncé’s performance cause damn she slayed😭😍,"Port St Lucie, FL","[-80.457446, 27.20569]"
-84.3833819,33.462988,Beyonce is still going. Wow. She’s amazing fr.,"Irondale, GA","[-84.3833819, 33.462988]"
-90.135782,34.994192,beyonce makes my heart smile!,"Memphis, TN","[-90.135782, 34.994192]"
-79.0075886,35.866334,#NC is #2 in having the most #hbcu ‘s in the country  so #beyonce showing out bringing the #Coachella18 https://t.co/ZWl1PHjAP1,"Durham, NC","[-79.0075886, 35.866334]"
-117.282538,32.53962,@Karnythia Please excuse me for my lame ramblings.  I've deleted my comment on your excellent suggestion that Beyon… https://t.co/5y2rPq8uaX,"San Diego, CA","[-117.282538, 32.53962]"
-93.329515,44.889964,"https://t.co/cgsv29IINi

Watch it. Incredible. #Beycheclla","Minneapolis, MN","[-93.329515, 44.889964]"
-116.2165486,33.653032,watching Beyoncé preform live is life changing https://t.co/8bAFm00LsG,"Coachella, CA","[-116.2165486, 33.653032]"
-91.51308,36.970298,Real talk...#Beyonce went absolutely crazy at #Coachella2018,"Illinois, USA","[-91.51308, 36.970298]"
-71.033007,42.388503,Ugh that crowd didn’t deserve Beyoncé. She was performing for the live stream and the 20% of that crowd who underst… https://t.co/wwCF9sCoDe,"Revere, MA","[-71.033007, 42.388503]"
-95.823268,29.522325,"I’m curious for the Beyonce fans, if she told y’all to snort a line of cocaine would y’all do it?","Houston, TX","[-95.823268, 29.522325]"
-86.348441,39.631677,beyoncé is undefeated idc 🤷🏾‍♀️slander will not be tolerated ever https://t.co/JWjtNqfDGl,"Indianapolis, IN","[-86.348441, 39.631677]"
-121.576613,38.43792,"Okay Twitter, I’ll join in because apparently there’s nothing else to discuss today... Beyonce Beyonce Beyonce Beyo… https://t.co/VBRgC4cmUX","Sacramento, CA","[-121.576613, 38.43792]"
-71.120889,42.381992,"#Beychella looked lit cause of Beyoncé, but the crowd sounds hella weak","Spring Hill, Somerville","[-71.120889, 42.381992]"
-79.476683,35.1145386,Beyoncé’s performance makes me miss A&amp;T so much lol,"Aberdeen, NC","[-79.476683, 35.1145386]"
-118.668404,33.704538,no se si soy la unica ala que le vale verga beyonce,"Los Angeles, CA","[-118.668404, 33.704538]"
-83.339919,42.274944,Sorry by Beyoncè will forever be a girl anthem🙌🏽,"Inkster, MI","[-83.339919, 42.274944]"
-84.576827,33.6475029,@V_DEL_ROSSI https://t.co/SYO5guoHwH,"Atlanta, GA","[-84.576827, 33.6475029]"
-81.2244846,28.56471,"if anyone dares to do a biopic of beyoncè, that shit better be epic","University, FL","[-81.2244846, 28.56471]"
-71.134552,42.3727525,Just finished watching the entire Beyonce performance at Coachella. I only cried twice which feels like win. Hurry… https://t.co/fk5dpDAftn,"Somerville, MA","[-71.134552, 42.3727525]"
-115.2092535,35.984784,@WhatsYour_iKieu i would go for beyoncé,"Paradise, NV","[-115.2092535, 35.984784]"
-85.847503,38.108678,Beyonce not slick she said she bdk https://t.co/7owi3A74Bs,"Louisville, KY","[-85.847503, 38.108678]"
-96.977527,32.620678,Anyone know here I can watch Beyoncé’s Coachella performance ? 👀,"Dallas, TX","[-96.977527, 32.620678]"
-119.207649,35.354368,"imo beyonce isnt as great as every one makes her seem , her followers are annoying af . @ me idccccc https://t.co/OStpvTrSKT","Rosedale, CA","[-119.207649, 35.354368]"
-83.214001,42.620953,Beyoncè was looking about good as hell last night and I don’t even like her like that. Them shorts fire too,"Rochester Hills, MI","[-83.214001, 42.620953]"
-90.135782,34.994192,Beyonce ushered us right out of mercury retrograde. Amen and praise the Lord.,"Memphis, TN","[-90.135782, 34.994192]"
-76.843666,39.38247,me to beyoncé https://t.co/huQNRH6XB0,"Owings Mills, MD","[-76.843666, 39.38247]"
-124.482003,32.528832,Les Twins at Coachella 2018 performing with beyonce 💙 #lestwins #lestwinsfam #loveslestwins… https://t.co/kqHwtXwFtf,"California, USA","[-124.482003, 32.528832]"
-76.9873,38.822422,if you don't like beyonce your homophobic.,"Hillcrest Heights, MD","[-76.9873, 38.822422]"
-87.940033,41.644102,Anyone else frantically googling Beyoncé’s full Coachella performance today? #BowDown #QueenB #Beychella,"Chicago, IL","[-87.940033, 41.644102]"
-121.520904,37.6727459,I wasn’t stressing so much about seeing Beyoncé at Coachella but now that I know she brought out Les Twins and DEST… https://t.co/7EyvS7JBxj,"Tracy, CA","[-121.520904, 37.6727459]"
-118.668404,33.704538,Ive watched Beyoncé’s set twice now,"Los Angeles, CA","[-118.668404, 33.704538]"
-84.64724,33.9552575,Beyoncé did not deserve that unhyped crowed I am not here for it,"Kennesaw, GA","[-84.64724, 33.9552575]"
-116.421818,33.670765,"Despite #beyonce not letting any accredited press photograph from the pit at #Coachella, @bvdbrug @luissinco and I… https://t.co/35JM2exOOP","Palm Desert, CA","[-116.421818, 33.670765]"
-77.26774,39.078493,@Beybroadz @Beyonce You're violating the laws of physics!,"North Potomac, MD","[-77.26774, 39.078493]"
-122.7900653,45.421863,Beyoncé is overrated. Don’t @ me.,"Portland, OR","[-122.7900653, 45.421863]"
-84.344742,39.832662,Beyonce is itttttttt . She is everythingggggg .,"Englewood, OH","[-84.344742, 39.832662]"
-75.715802,38.152156,Things Beyonce &amp; that band did: THAT✔️,"Princess Anne, MD","[-75.715802, 38.152156]"
-95.774704,35.995476,"I’ve never seen so many dudes hate on Beyoncé in my life. Chill, go watch the nba playoffs. Y’all acting like y’all… https://t.co/W3pKwZcRTn","Missouri, USA","[-95.774704, 35.995476]"
-77.119401,38.801826,Dawns in me that Cardi B @iamcardib is performing at #Coachella after Beyoncé’s Coachella performance this should b… https://t.co/kIs5oJaaJh,"Washington, DC","[-77.119401, 38.801826]"
-80.2089316,25.9141456,"I’m studying this picture, beyonce Queen in deed. Shout out to all the people you don’t see… https://t.co/4K1WZcumE0","North Miami Beach, FL","[-80.2089316, 25.9141456]"
-124.482003,32.528832,Twinchella 🔥🔥🔥 Les Twins at Coachella 2018 performing with beyonce 💙 #lestwins #lestwinsfam… https://t.co/Nw1AciwLzX,"California, USA","[-124.482003, 32.528832]"
-83.288056,42.255085,Nicki X Beyoncé is something that will forever be untouched ❗️,"Detroit, MI","[-83.288056, 42.255085]"
-74.041878,40.570842,@Jo_GotGame 4 is a good album. But Beyoncè is her best work. But 4 has 1+1 🤗,"Brooklyn, NY","[-74.041878, 40.570842]"
-76.7115205,39.197211,"There was no way I was gonna finish watching that Beyonce performance and not go to the gym immediately afterward, gloomy rain be damned","Baltimore, MD","[-76.7115205, 39.197211]"
-81.883223,41.275311,What happened with Beyoncé,"Strongsville, OH","[-81.883223, 41.275311]"
-81.2858956,28.8451104,BEYONCÉ IS AMAZING,"Deltona, FL","[-81.2858956, 28.8451104]"
-157.950476,21.254837,So Beyoncè shut it down last night,"Honolulu, HI","[-157.950476, 21.254837]"
-117.704483,34.086988,Can someone please explain to me why people treat Beyoncé like she’s a god.,"Upland, CA","[-117.704483, 34.086988]"
-117.5243291,34.033432,Me after watching @Beyonce ‘s full performance https://t.co/bBQ5LJXATf,"Fontana, CA","[-117.5243291, 34.033432]"
-81.046876,35.001706,Block anyone throwing shade at Beyoncé and don’t give it any retweets or comments. You don’t need that negativity on your Twitter timeline.,"Charlotte, NC","[-81.046876, 35.001706]"
-96.977527,32.620678,i wasn’t gone go but in honor of her shutting down Coachella i’ll be going to all Beyoncé everything at rbc tonight LMAO,"Dallas, TX","[-96.977527, 32.620678]"
-84.197462,33.7142489,"Beyoncé’s stage was so black, cultured and pleasing to watch.","Redan, GA","[-84.197462, 33.7142489]"
-124.482003,32.528832,Les Twins at Coachella 2018 performing with beyonce 💙 #lestwins #lestwinsfam #loveslestwins… https://t.co/wSeVG9cACN,"California, USA","[-124.482003, 32.528832]"
-118.668404,33.704538,Coachella - day 2 ✅ #beyonce #portraitmode #crewlove - best birthday ever 🙌🏽🐝 @ Coachella Music… https://t.co/col7baFpMS,"Los Angeles, CA","[-118.668404, 33.704538]"
-86.25064,39.5293583,Hard core Beyoncé fans have the worst attitude smh.,"Greenwood, IN","[-86.25064, 39.5293583]"
-87.940033,41.644102,Literally me watching @Beyonce  SLAYYYY at Coachella https://t.co/VjXqJKNz8H,"Chicago, IL","[-87.940033, 41.644102]"
-117.2132149,46.70823,"Beyoncé body really a crazy piece of work to, she thick, but muscular, long ass leg but she’s 5 foot 7, can sing an… https://t.co/IK9BBrzdG7","Pullman, WA","[-117.2132149, 46.70823]"
-90.208137,29.934187,Women who cry over men hate men and caucasians who don’t like black people hate beyonce. Two very different things… https://t.co/Vgp8BSNC8a,"Elmwood, LA","[-90.208137, 29.934187]"
-97.340667,32.988286,I’m so mad that I didn’t get to see Beyoncé’s performance 😩,"Roanoke, TX","[-97.340667, 32.988286]"
-80.926273,40.052557,"instead of a speech at my wedding, i want my sister to do a full on wild ass routine to a Beyoncé medley. I’m counting on it.","St Clairsville, OH","[-80.926273, 40.052557]"
-71.4971703,42.257263,@AnerMartino1 @Beyonce Lol I’m done w you,"Framingham, MA","[-71.4971703, 42.257263]"
-85.899573,38.115961,@quintabrunson Beyoncé* I got your back sus. Because the hive was coming.,"Pleasure Ridge Park, KY","[-85.899573, 38.115961]"
-116.301227,33.685344,Beyoncé didn’t give us a performance she gave us a whole production,"Indio, CA","[-116.301227, 33.685344]"
-84.576827,33.6475029,My girl showed ‘tf out last night. #BEYCHELLA #Coachella #Beyonce #BeyHive https://t.co/JALkgTSy0u,"Atlanta, GA","[-84.576827, 33.6475029]"
-117.039699,46.710846,"Also, this is your friendly reminder I’m so over Beyonce. 🙄🙄","Moscow, ID","[-117.039699, 46.710846]"
-116.374119,33.6718148,CAN’T BELIEVE BEYONCE REUNITED DESTINY LAST NIGHT. THE BEST SURPRISE APPEARANCE EVER 😭😭😭,"Indian Wells, CA","[-116.374119, 33.6718148]"
-83.200169,39.832013,Beyoncé is one of very few artists that you don’t have to demand more from. It’s not too many artists in this indus… https://t.co/3tVb3jOqxo,"Columbus, OH","[-83.200169, 39.832013]"
-77.119401,38.801826,I need the full Beyoncé Coachella performance 🙄,"Washington, DC","[-77.119401, 38.801826]"
-124.482003,32.528832,"Day Two recap: CHIC / BORNS / David Byrne / Tyler, The Creator / Jungle / Beyoncé. Top 3 of the… https://t.co/cKswbRUBuy","California, USA","[-124.482003, 32.528832]"
-74.25475,40.859529,Literally LITERALLY crying at Beyoncé singing the Black National Anthem,"Little Falls, NJ","[-74.25475, 40.859529]"
-86.7858813,34.5784264,Yep Beyoncé is a different person when she performs ‼️ https://t.co/Pevk3wYAkJ,"Huntsville, AL","[-86.7858813, 34.5784264]"
-87.634643,24.396308,Seriously how do you wake up as Beyonce today knowing you just slayed the whole nation? I’m sorry world*… https://t.co/Eyj9p0T8Uo,"Florida, USA","[-87.634643, 24.396308]"
-124.482003,32.528832,"@OnlyAlessandro @Beyonce Like, so epic. Supposedly Eminem is bringing her out tonight too 💀","California, USA","[-124.482003, 32.528832]"
-73.989318,41.467644,We are mesmerized @Beyonce https://t.co/ufMJQ4TD5d,"Beacon, NY","[-73.989318, 41.467644]"
-73.962582,40.541722,Michael Jackson &amp; Beyoncé are no where near each other! MJ was a GOD &amp; bey is just some chick from Texas y’all like… https://t.co/OQ1h5aI5xC,"Queens, NY","[-73.962582, 40.541722]"
-97.928935,30.127892,Super excited about sitting in on the podcast about Beyoncé @ #TinyTexasPodcast https://t.co/EVIWAsv3ka,"Austin, TX","[-97.928935, 30.127892]"
-85.605166,30.355644,Fuck Beyonce,"Georgia, USA","[-85.605166, 30.355644]"
-75.716794,39.599414,Beyonce at Coachella: All of the hidden meanings explained  - ABC News -  via @ABC https://t.co/BT691AU8gr,"Bear, DE","[-75.716794, 39.599414]"
-83.5218655,33.877554,"Beyoncé’s TEAM though, unmatched. The planning, camera angles, choreo, dancers, light effects, just EVERYTHING. Bey… https://t.co/oyQlTA4GmM","Athens, GA","[-83.5218655, 33.877554]"
-86.7858813,34.5784264,Beyoncé’s performance makes me wanna pledge and idk anything about so if anyone can educate me that’d be great,"Huntsville, AL","[-86.7858813, 34.5784264]"
-83.353955,32.04683,Y’all will not sit here and act like chris brown can even come close to beyonce 🤣🤣,"South Carolina, USA","[-83.353955, 32.04683]"
-92.5215951,34.6259499,don’t fight me but i’ve never understood the big deal about beyonce. meh.,"Little Rock, AR","[-92.5215951, 34.6259499]"
-97.1686653,32.822102,"yeah i gotta stay off social media until next weekend. i’ve already muted coachella, beychella and beyonce.","Bedford, TX","[-97.1686653, 32.822102]"
-105.109815,39.614151,"If Beyoncé doesn’t have public figure in her bio, neither should you","Denver, CO","[-105.109815, 39.614151]"
-82.9732981,42.539309,"1. Bitch YESSSSS
2. I wish my legs looked like Beyoncé’s https://t.co/v704N1YaUH","Clinton, MI","[-82.9732981, 42.539309]"
-116.421818,33.670765,@Instaval_tt Actual footage of me moved by @Beyonce https://t.co/phQXvIT8Zy,"Palm Desert, CA","[-116.421818, 33.670765]"
-80.519851,39.719801,@itstracyg @Beyonce Beyoncé got me EXCITED to go the gym from her #BEYCHELLA performance. Only Beyoncé.,"Pennsylvania, USA","[-80.519851, 39.719801]"
-87.940033,41.644102,I really don’t get how anyone could not like Beyoncé....,"Chicago, IL","[-87.940033, 41.644102]"
-100.401458,35.893449,beyoncé is trash don’t @ me,"Canadian, TX","[-100.401458, 35.893449]"
-87.709565,41.630338,No matter how many retweets and likes that come you still can't get the attention Beyoncé get lol https://t.co/nS3hk01Joj,"Blue Island, IL","[-87.709565, 41.630338]"
-118.668404,33.704538,Beyoncé out did coachella when she sang the black national anthem.... that was ALL she needed to do.. Black will al… https://t.co/j0XN5qkBLK,"Los Angeles, CA","[-118.668404, 33.704538]"
-83.5218655,33.877554,I love Beyoncé. Like I truly truly do. Always have. But some of her fans make me question whether I want to or even… https://t.co/1skaG2Ayyq,"Athens, GA","[-83.5218655, 33.877554]"
-121.4168716,37.883347,"@tomjoynerfound Thanks Beyoncé ..  from a#HBCUSWCC #HBCUHampton 
Connection","Stockton, CA","[-121.4168716, 37.883347]"
-85.800502,33.752607,I lied..I thought I saw all of Beyoncé’s performance but I didn’t 😂,"Jacksonville, AL","[-85.800502, 33.752607]"
-87.709565,41.630338,Kim K be desperate as hell when Beyoncé already finagled America with her presence. At this point it's just sad to… https://t.co/e1cQo35ACc,"Blue Island, IL","[-87.709565, 41.630338]"
-82.620093,27.821353,"Shinin, shinin, shinin, shinin, yeah *in my Beyoncé voice* 🍫✨👑 #SwipeLeft

#PoolSideChillin… https://t.co/lY0L1lq1Rx","Tampa, FL","[-82.620093, 27.821353]"
-118.365715,33.9827564,"My love for Beyonce is more of a passive, watch and admire from afar and keep it to myself most of the time kind of… https://t.co/e4DDVq8kwk","View Park-Windsor Hills, CA","[-118.365715, 33.9827564]"
-122.514926,37.708075,"beyonce is certainly one of the greatest live performers ever. period. damn she actually sings, sounds amazing and… https://t.co/ulw731gTcI","San Francisco, CA","[-122.514926, 37.708075]"
-80.229746,25.8922648,Beyoncé can give y’all shit outta toilet and tell y’all it’s chocolate and y’all asses will eat it 2,"Golden Glades, FL","[-80.229746, 25.8922648]"
-122.514926,37.708075,"Beyoncé, my favorite virgo","San Francisco, CA","[-122.514926, 37.708075]"
-85.605166,30.355644,Beyonce killed everything at coachella. Best performing artists I’d say https://t.co/wz3i2SjUG8,"Georgia, USA","[-85.605166, 30.355644]"
-98.778559,29.141956,@Johnny_Boy7894 There will always be more! Coachella is overrated and my friends are mad that beyonce had all the o… https://t.co/7PWyj2weEG,"San Antonio, TX","[-98.778559, 29.141956]"
-104.910562,38.741142,"After that @Beyonce performance at #BeyChellla we all headed back to college, going to a #HBCU and pledging… https://t.co/greINvsYMI","Colorado Springs, CO","[-104.910562, 38.741142]"
-87.709565,41.630338,@Jordan__IX Because she knew Beyoncé was performing this weekend. Lol every time Beyoncé got something going on she… https://t.co/TjuX20WXI0,"Blue Island, IL","[-87.709565, 41.630338]"
-77.119401,38.801826,Beyoncé is a Black woman. Y’all hate to say that word huh? Say it with me! She👏🏾 is👏🏾 a 👏🏾Black 👏🏾woman👏🏾 https://t.co/XxJwdHIunH,"Washington, DC","[-77.119401, 38.801826]"
-116.301227,33.685344,"Hi, here’s beyonce from my point of view https://t.co/S5Apfn8jeK","Indio, CA","[-116.301227, 33.685344]"
-122.436232,47.4953154,Beyonce the goat https://t.co/b2XXeODnRV,"Seattle, WA","[-122.436232, 47.4953154]"
-84.8203089,38.403186,Beyoncé makes me so proud to be a Virgo 😭❤️,"Ohio, USA","[-84.8203089, 38.403186]"
-118.3959042,34.075963,Thankful for @coachella live stream. I was liv-ving last night. That @Beyonce performance was every damn thing #Beychella #DestinysChild,"West Hollywood, CA","[-118.3959042, 34.075963]"
-96.683671,32.700664,@krystalsoboujee lmao people swear she the oddball for no reason she just not out there like Beyoncé and Kelly are,"Mesquite, TX","[-96.683671, 32.700664]"
-117.954201,33.625179,Can someone teach a branding class on Beyoncé?,"Costa Mesa, CA","[-117.954201, 33.625179]"
-97.028288,32.541286,I HAVE to go to the Beyoncé concert in September!!,"Cedar Hill, TX","[-97.028288, 32.541286]"
